{
  "$schema": "../schemas/marketplace.schema.json",
  "name": "florin-popa-marketplace",
  "owner": {
    "name": "FlorinPopaCodes"
  },
  "metadata": {
    "description": "Person  collection of skills and plugins for Claude Code",
    "version": "1.0.0",
    "pluginRoot": "./plugins"
  },
  "plugins": [
    {
      "name": "always-works-testing",
      "source": "./plugins/always-works-testing",
      "description": "Default testing standard for all implementation work - ensures code actually works through mandatory execution validation before confirming to user.",
      "version": "1.0.0",
      "author": {
        "name": "FlorinPopaCodes"
      },
      "license": "Unlicense",
      "category": "testing",
      "keywords": ["testing", "validation", "quality", "verification", "TDD"],
      "tags": ["featured", "beginner-friendly"]
    },
    {
      "name": "simplicity-first",
      "source": "./plugins/simplicity-first",
      "description": "Cornerstone plugin embedding the 'simplest thing that could possibly work' philosophy into ALL development tasks. YAGNI as supreme principle - design for now, not imagined futures. Inspired by Sean Goedecke's article.",
      "version": "1.0.0",
      "author": {
        "name": "FlorinPopaCodes"
      },
      "homepage": "https://www.seangoedecke.com/the-simplest-thing-that-could-possibly-work/",
      "license": "Unlicense",
      "category": "architecture",
      "keywords": [
        "simplicity",
        "YAGNI",
        "architecture",
        "design",
        "cornerstone",
        "philosophy"
      ],
      "tags": ["featured", "cornerstone", "best-practices"]
    }
  ]
}
